<?xml version="1.0" encoding="UTF-8"?>
<?xml-stylesheet type="text/xsl" href="faculty.xsl"?>
<faculty xmlns:xsi="http://www.w3.org/2001/XMLSchema-instance" xsi:noNamespaceSchemaLocation="faculty.xsd">
    <facultyMember>
        <id>FAC-001</id>
        <name>Dr. Rodrigo Lacson</name>
        <department>College of Arts &amp; Sciences</department>
        <subjects>
            <subject>
                <subjectName>Ethics</subjectName>
                <hours>3</hours>
            </subject>
            <subject>
                <subjectName>Understanding the Self</subjectName>
                <hours>3</hours>
            </subject>
            <subject>
                <subjectName>Art Appreciation</subjectName>
                <hours>3</hours>
            </subject>
            <subject>
                <subjectName>Contemporary World</subjectName>
                <hours>3</hours>
            </subject>
            <subject>
                <subjectName>Readings in Philippine History</subjectName>
                <hours>3</hours>
            </subject>
        </subjects>
        <totalHours>15</totalHours>
    </facultyMember>
    <facultyMember>
        <id>FAC-002</id>
        <name>Sir Lito Pacquiao</name>
        <department>College of Computer Studies</department>
        <subjects>
            <subject>
                <subjectName>Software Engineering</subjectName>
                <hours>3</hours>
            </subject>
            <subject>
                <subjectName>Human Computer Interaction</subjectName>
                <hours>3</hours>
            </subject>
            <subject>
                <subjectName>Object-Oriented Programming</subjectName>
                <hours>3</hours>
            </subject>
            <subject>
                <subjectName>Artificial Intelligence</subjectName>
                <hours>3</hours>
            </subject>
            <subject>
                <subjectName>Web Systems and Technologies</subjectName>
                <hours>3</hours>
            </subject>
            <subject>
                <subjectName>Network Security</subjectName>
                <hours>3</hours>
            </subject>
        </subjects>
        <totalHours>18</totalHours>
    </facultyMember>
    <facultyMember>
        <id>FAC-003</id>
        <name>Sir Manuel Pacquiao</name>
        <department>College of Education</department>
        <subjects>
            <subject>
                <subjectName>Facilitating Learner-Centered Teaching</subjectName>
                <hours>3</hours>
            </subject>
            <subject>
                <subjectName>The Teaching Profession</subjectName>
                <hours>3</hours>
            </subject>
            <subject>
                <subjectName>Technology for Teaching and Learning</subjectName>
                <hours>3</hours>
            </subject>
        </subjects>
        <totalHours>9</totalHours>
    </facultyMember>
    <facultyMember>
        <id>FAC-004</id>
        <name>Dr. Elena Pangilinan</name>
        <department>College of Nursing</department>
        <subjects>
            <subject>
                <subjectName>Nutrition and Dietetics</subjectName>
                <hours>3</hours>
            </subject>
            <subject>
                <subjectName>Microbiology and Parasitology</subjectName>
                <hours>4</hours>
            </subject>
            <subject>
                <subjectName>Medical-Surgical Nursing</subjectName>
                <hours>6</hours>
            </subject>
        </subjects>
        <totalHours>13</totalHours>
    </facultyMember>
    <facultyMember>
        <id>FAC-005</id>
        <name>Dr. Imelda Pangilinan</name>
        <department>College of Education</department>
        <subjects>
            <subject>
                <subjectName>Foundation of Special Education</subjectName>
                <hours>3</hours>
            </subject>
            <subject>
                <subjectName>Assessment in Learning</subjectName>
                <hours>3</hours>
            </subject>
            <subject>
                <subjectName>The Teaching Profession</subjectName>
                <hours>3</hours>
            </subject>
            <subject>
                <subjectName>Educational Leadership</subjectName>
                <hours>3</hours>
            </subject>
        </subjects>
        <totalHours>12</totalHours>
    </facultyMember>
    <facultyMember>
        <id>FAC-006</id>
        <name>Dr. Ricardo Hontiveros</name>
        <department>College of Nursing</department>
        <subjects>
            <subject>
                <subjectName>Anatomy and Physiology</subjectName>
                <hours>4</hours>
            </subject>
            <subject>
                <subjectName>Microbiology and Parasitology</subjectName>
                <hours>4</hours>
            </subject>
            <subject>
                <subjectName>Medical-Surgical Nursing</subjectName>
                <hours>6</hours>
            </subject>
        </subjects>
        <totalHours>14</totalHours>
    </facultyMember>
    <facultyMember>
        <id>FAC-007</id>
        <name>Dr. Ferdinand Sotto</name>
        <department>College of International Hospitality Management</department>
        <subjects>
            <subject>
                <subjectName>Food and Beverage Service</subjectName>
                <hours>4</hours>
            </subject>
            <subject>
                <subjectName>Hospitality Marketing</subjectName>
                <hours>3</hours>
            </subject>
            <subject>
                <subjectName>Tourism Management</subjectName>
                <hours>3</hours>
            </subject>
            <subject>
                <subjectName>Events Management</subjectName>
                <hours>3</hours>
            </subject>
            <subject>
                <subjectName>Kitchen Essentials</subjectName>
                <hours>4</hours>
            </subject>
            <subject>
                <subjectName>Travel and Tour Operations</subjectName>
                <hours>3</hours>
            </subject>
        </subjects>
        <totalHours>20</totalHours>
    </facultyMember>
    <facultyMember>
        <id>FAC-008</id>
        <name>Dr. Maria Pascual</name>
        <department>College of Education</department>
        <subjects>
            <subject>
                <subjectName>Foundation of Special Education</subjectName>
                <hours>3</hours>
            </subject>
            <subject>
                <subjectName>Curriculum Development</subjectName>
                <hours>3</hours>
            </subject>
            <subject>
                <subjectName>Child and Adolescent Development</subjectName>
                <hours>3</hours>
            </subject>
            <subject>
                <subjectName>Facilitating Learner-Centered Teaching</subjectName>
                <hours>3</hours>
            </subject>
        </subjects>
        <totalHours>12</totalHours>
    </facultyMember>
    <facultyMember>
        <id>FAC-009</id>
        <name>Dr. Paulo Mendoza</name>
        <department>College of Education</department>
        <subjects>
            <subject>
                <subjectName>Educational Leadership</subjectName>
                <hours>3</hours>
            </subject>
            <subject>
                <subjectName>Child and Adolescent Development</subjectName>
                <hours>3</hours>
            </subject>
            <subject>
                <subjectName>Assessment in Learning</subjectName>
                <hours>3</hours>
            </subject>
            <subject>
                <subjectName>Foundation of Special Education</subjectName>
                <hours>3</hours>
            </subject>
            <subject>
                <subjectName>Curriculum Development</subjectName>
                <hours>3</hours>
            </subject>
            <subject>
                <subjectName>Facilitating Learner-Centered Teaching</subjectName>
                <hours>3</hours>
            </subject>
        </subjects>
        <totalHours>18</totalHours>
    </facultyMember>
    <facultyMember>
        <id>FAC-010</id>
        <name>Dr. Liza Bautista</name>
        <department>College of Education</department>
        <subjects>
            <subject>
                <subjectName>Assessment in Learning</subjectName>
                <hours>3</hours>
            </subject>
            <subject>
                <subjectName>Educational Leadership</subjectName>
                <hours>3</hours>
            </subject>
            <subject>
                <subjectName>Curriculum Development</subjectName>
                <hours>3</hours>
            </subject>
            <subject>
                <subjectName>Technology for Teaching and Learning</subjectName>
                <hours>3</hours>
            </subject>
            <subject>
                <subjectName>Specialization Project</subjectName>
                <hours>18</hours>
            </subject>
        </subjects>
        <totalHours>30</totalHours>
    </facultyMember>
    <facultyMember>
        <id>FAC-011</id>
        <name>Prof. Jovita Garcia</name>
        <department>College of Nursing</department>
        <subjects>
            <subject>
                <subjectName>Pharmacology</subjectName>
                <hours>3</hours>
            </subject>
            <subject>
                <subjectName>Fundamentals of Nursing</subjectName>
                <hours>5</hours>
            </subject>
            <subject>
                <subjectName>Nursing Care Management</subjectName>
                <hours>5</hours>
            </subject>
            <subject>
                <subjectName>Medical-Surgical Nursing</subjectName>
                <hours>6</hours>
            </subject>
            <subject>